poi_id,poi_name,poi_type,poi_subtype,commentId,content,score,touristTypeDisplay,timeDuration,sortType,commentTagId,source,publish_date,city,景点名,sentiment,is_study,age_group,月份,季节,节假日
76901,南越王博物院(王墓展区),知识科普型,博物馆,163531658,南越王博物馆，在早期的时候都习惯叫他南越王墓，到时候的南越王宫还没有发掘出来，记得第一次去的时候是初中的时候了，当时因为是爱国教育，所以的话是可以免费进入的，里面真的是挺大，除了有常规的展览之外，还有特展，是对于广州非常重要的一段历史，也有非常多的珍宝。,4,,,,,,2020-05-27,广东,,正面评论,TRUE,初中,5,春,春季学期
87819,广东科学中心,知识科普型,科技馆,157838564,这里很适合一家大小去玩，又能学到知识，小孩子大点，最好在初中以上的学生去玩，低年级的学生只是去玩，见识见识一下而已，还有很多不懂，这里门票很便宜，停车费4.5元一次，值得去的地方,4,,,,,,2019-02-10,广东,,正面评论,TRUE,初中,2,冬,寒假
87819,广东科学中心,知识科普型,科技馆,203959722,适合初中以下的学生群，趣味性不错，建议错峰出行，小朋友特别多，家长有时候也会参与到游戏中，所以做好安全保护也是有必要的，场馆设几个打卡拍照的地方就好了🙏,4,家庭亲子,2小时,,,,2025-02-12,广东,,正面评论,TRUE,初中,2,冬,寒假
87819,广东科学中心,知识科普型,科技馆,159838017,馆比较大，分几个馆。其中一个都是涉及初中高中物理知识，比较适合初中及以上的人去。另一个是儿童天地，很多趣味的生活哲理学习，小朋友玩得很开心。,5,,,,,,2019-07-20,广东,,正面评论,TRUE,初中,7,夏,暑假
87819,广东科学中心,知识科普型,科技馆,160006244,广东科学中心适合带孩子在趣味中学习科学知识的好地方。价格不贵内容很丰富，小至三岁到初中生都适合呆上大半天。很棒：,5,,,,,,2019-07-30,广东,,正面评论,TRUE,初中,7,夏,暑假
87819,广东科学中心,知识科普型,科技馆,166128492,展厅规划合理，很多项目设施能做到寓教于乐，孩子很喜欢。改进建议： 1，休息设施不足，人多时候只能席地而坐。 2，基础科学小实验少了些，可以多些面向初中生的物理实验，让孩子不止玩儿个热闹。,5,家庭亲子,,,,,2021-04-04,广东,,正面评论,TRUE,初中,4,春,春季学期
87819,广东科学中心,知识科普型,科技馆,166877711,总体超赞，有趣好玩，挺多项目趣味性，知识性都很强，适合带小孩子参观。不足之处就是基本没有讲解，说明也不够具体直观，要初中以上学生比较适合。,5,家庭亲子,,,,,2021-06-20,广东,,正面评论,TRUE,初中,6,夏,春季学期
64673617,汤臣倍健营养探索馆,知识科普型,科技馆,175283888,带娃来这里玩，娃很喜欢，去车间看到机器人很兴奋，车间非常的整洁，工厂里面是不允许吃东西的，进去还会穿鞋套帽套，洁净程度很高，营养探索馆也是娃非常喜欢玩的，里面很多玩的项目，周末带娃的好去处，而且了解一下，他们还有研学游，正好儿子初中能用得上,5,,,,,,2023-03-24,广东,,正面评论,TRUE,初中,3,春,春季学期
31068658,五皇山,自然观赏型,自然保护区,157816100,大年初一，全家一起登五皇山，登高望远。我们从南门买票上，现场票30，网上买20，学生均10元。从南门左边延梯而上，景色很宜人，各种溪水，绕梯而上，空气很清新！到了半山腰，上蹿下跳的野猴很多，我感受到人与自然的和谐。如果你用塑料袋提着水果，被它们看到的话，可能会被淘气点的猴子打劫去。山顶的风景很美，可以远眺山脉，风力发电机，还有独一无二的南阳山。唯一不足的是，垃圾有点多。同是游客人，同是为赏景而去，不应随手扔垃圾，好环境与爱生活、爱自然的人共享！若是光靠工作人员清扫整座山垃圾，太不易了！,4,,,,,,2019-02-08,广西,,正面评论,TRUE,初中,2,冬,寒假
79598,中华麋鹿园,自然观赏型,自然保护区,180692254,听说园区还会举办一些特色活动，如麋鹿节、生态摄影比赛等，这些活动增加了游客的互动性和体验性，受到了积极的评价。不过，我们初二上午去没看到，园区可以增加更多的互动体验项目以提高游客的参与度和满意度。总体来说，大丰中华麋鹿园还是能体现在生态保护、教育意义和自然体意思。存在一些设施维护和服务质量方面的改进空间。大丰中华麋鹿园是一个值得推荐的目的地。,4,家庭亲子,,,,,2024-02-11,江苏,,正面评论,TRUE,初中,2,冬,寒假
91492,中国科举博物馆(江南贡院),知识科普型,博物馆,160576177,四层博物馆，值得初高中孩子去参观学习，不要总是抱怨学习太累，看看古人，现在的学习、考试条件不知道好了多少﹉,5,,,,,,2019-08-24,江苏,,正面评论,TRUE,初中，高中,8,夏,暑假
15009231,六朝博物馆,知识科普型,博物馆,160497934,感受六朝历史的好地方，适合初中以上学生去,5,,,,,,2019-08-20,江苏,,正面评论,TRUE,初中,8,夏,暑假
15009231,六朝博物馆,知识科普型,博物馆,203815571,还行，没啥服务，盖章要收费的，环境一般，地方不大，两个小时可以，初中以上的孩子可以，太小没啥可看的，文字类的很多，有学生参加活动，人不少,4,家庭亲子,2小时,,,,2025-02-09,江苏,,正面评论,TRUE,初中,2,冬,寒假
15009231,六朝博物馆,知识科普型,博物馆,160656885,初中的孩子学习历史特别好，六朝历史六朝文物，感谢馆里的讲解志愿者，讲的非常好,5,,,,,,2019-08-28,江苏,,正面评论,TRUE,初中,8,夏,暑假
80549,南京博物院,知识科普型,博物馆,162188823,南京博物院是中国三大博物馆之一，中国最早创建的博物馆，由历史馆、艺术馆、特展馆、数字馆、民国馆和非遗馆组成。 馆内藏品42余万件，各式名贵珍品，不仅是参观用途，也有着历史发掘、研究的意义。 在《国家宝藏》节目中展示的大报恩寺琉璃塔拱门，就是收藏于此。 博物馆实行的免票形式，持有效证件登记领票就可以入内参观。 开放时间:09:00-12:00；停止售票时间:11:00 (1月1日-12月31日 周一)09:00-17:00；停止入场时间:16:00 (1月1日-12月31日 周二-周日) tips: 周一逢国家法定节假日全天开放 每年除夕、大年初一闭馆休整。凭有效证件（身份证、户口本、学生证、医保卡等）现场免费领票。或在官网上免费预约门票后再到现场领票。,5,,,,,,2019-12-03,江苏,,正面评论,TRUE,初中,12,冬,秋季学期
56094160,南通森林野生动物园,知识科普型,动物园,164619386,个人觉得这个价位真心不值，和上海南京的差的有点多，动物没那么多，不知道哪来的勇气175一张票的，关键还没学生票，我外甥女初二也要买成人票，真心不划算，而且主要今天玩着玩着还下雨了，一个一次性雨披都要20个，我们6个人雨披120一把伞48，着实太坑，去看熊猫的时候说熊猫午休时间，不能打扰，很是尴尬😓看到个午休背对着我们的熊猫背影，景区内我们吃的没买啥，知道贵自己带了水，不过买了烤肠，一人一个10块一根也谈不上有多贵还可以吧，就是雨披一次性的20是真的坑体验不佳，景色一般，性价比低，,3,朋友出游,,,,,2020-10-04,江苏,,中性评论,TRUE,初中,10,秋,十一假期
133553501,猫咪博物馆(弘阳广场店),知识科普型,博物馆,175151858,一点也不值得去！！！！69那么贵的，玩了个空气，还要带手套！我想退钱，我们还是学生那么贵，69诶，我们还没上初中呢,1,,,,,,2023-03-11,江苏,,负面评论,TRUE,初中,3,春,春季学期
75694,紫金山天文台,体验考察型,研学,209305041,家里有初高中生的值得去，有天文仪器和一些相关历史和科学介绍，还碰到了研学的高中生。上面有观景台 ，可看玄武湖和部分城景。我们一家三口公交车315到紫金山索道口，同站有20路车。然后自己爬山上去的，爬山有两条道，一条进入后不久在右手边，台阶多，爬起来累，但会稍微快10来分钟吧，另一条平坦一点。我们周六去的，在路口处停了一辆绿色中巴，大约二十分钟看人数多少可以直接开到天文台（15元单程，周一到周五从白马公园，直接开到天文台），我们下山时赶时间就是乘这个绿色中巴下山的，然后在索道口喊了网约车离开的。,5,家庭亲子,2小时,,,,2025-04-20,江苏,,正面评论,TRUE,初中，高中,4,春,春季学期
82475,中国国花园,知识科普型,植物园,223233879,携程订票特别方便，随订随用，遇到人大附中的五个大巴车带着初一的学生看牡丹，唯有牡丹真国色，花开时节动京城。,5,家庭亲子,,1,0,,2025-09-07,河南,,正面评论,TRUE,初中,9,秋,秋季学期
77934,河南博物院,知识科普型,博物馆,168865430,有上初一的孩子建议去看看，有利于历史科目的学习,5,单独旅行,,1,-22,,2021-12-25,河南,,正面评论,TRUE,初中,12,冬,秋季学期
89920,洛阳博物馆,知识科普型,博物馆,181667213,神仙讲解！！！大伟老师今天讲解引人入胜，开头就知识框架直接架住，后面的每一个知识体系都有展开有反馈。感觉又回到我最喜欢的初中历史老师的课堂上了🥹非常感谢大伟老师，希望后面亲戚朋友再来洛阳，也来听大伟老师的讲解，学习到更多的知识。,5,情侣夫妻,3小时,,,,2024-05-01,河南,,正面评论,TRUE,初中,5,春,五一假期
89409513,郑州银基动物王国,知识科普型,动物园,165739240,河南终于有个像样的动物园了。春节初二人并不太多，动物游览车基本不怎么排队，虽然票价有些贵，不能和长隆相提并论，但是园区干净，服务好，放假值得带孩子来玩。 不知道为什么那么多人吐槽，88元烩面嫌贵，可以吃其他啊！再说园区让带食物，自己带些食物吃也是可以的。真的没有必要吹毛求疵。 2月份活动，孩子满分免门票活动也是超赞。鼓励孩子好好学习。,5,家庭亲子,,,,,2021-02-15,河南,,正面评论,TRUE,初中,2,冬,寒假
89409513,郑州银基动物王国,知识科普型,动物园,165739216,河南终于有个像样的动物园了。春节初二人并不太多，动物游览车基本不怎么排队，虽然票价有些贵，不能和长隆相提并论，但是园区干净，服务好，放假值得带孩子来玩。 不知道为什么那么多人吐槽，88元烩面嫌贵，可以吃其他啊！再说园区让带食物，自己带些食物吃也是可以的。真的没有必要吹毛求疵。 2月份活动，孩子满分免门票活动也是超赞。鼓励孩子好好学习。,5,家庭亲子,,,,,2021-02-15,河南,,正面评论,TRUE,初中,2,冬,寒假
61459158,千岛湖啤酒博物院,知识科普型,博物馆,171960966,非常差，一家四口一个孩子初中生必须出示学生证才让进 电子学生证也不让用 还说自己是私人的公司要求 太奇葩了 差评,1,,,,,,2022-08-06,浙江,,负面评论,TRUE,初中,8,夏,暑假
78087,天一阁博物院,知识科普型,博物馆,157870138,大年初一从金华出发去宁波，天一阁是在年初二早上的行程里。我们一家三口，还带上妈妈和婆婆，自驾前往。天一阁只要是未满18岁的学生，带上身份证、户口本或学生证都可在售票处旁边领取免费门票。年初二玩的人还是挺多的，走走逛逛可以玩大半天，里面吃的啥都没有，需要自带零食和水。小朋友逛逛也还挺喜欢。,5,,,,,,2019-02-12,浙江,,正面评论,TRUE,初中,2,冬,寒假
78087,天一阁博物院,知识科普型,博物馆,221501225,挺不错的，适合两三个小时游玩。适合初高中学生，不适合小朋友,5,家庭亲子,,1,0,,2025-08-22,浙江,,正面评论,TRUE,初中，高中,8,夏,暑假
10770415,宁波科学探索中心,知识科普型,科技馆,160687442,暑假里的工作日带孩子来的，人非常少，一大一小呆了一整天，还没有把全部的项目参观完，寓教于乐，真的特别好，跟前一天去的又贵又不好玩的罗蒙比，这个门票价格简直太值了。但是有些设施有点陈旧了，需要维修；幼儿园中大班开始到初中我觉得都可以带孩子来，科普的好地方。里面的餐厅价格也满实惠的，还可以自己点外面或者外出吃了再回来，总之，感受很好。,5,,,,,,2019-08-30,浙江,,正面评论,TRUE,初中,8,夏,暑假
13822344,浙江大学(紫金港校区),励志拓展型,大学,208480917,浙江大学紫金港校区作为主校区，以“现代化、园林化、生态化”著称，不仅是学术高地，更是融合自然与人文的城市新地标。以下结合最新动态与深度体验，为你梳理值得探索的六大维度亮点：   一、四季流转的自然美学   1. 春日限定的花事密码   - 启真湖畔的郁金香秘境：每年3月，120㎡的红色“人见人爱”郁金香花海与水杉林、黑天鹅共绘油画。2025年新增的蓝紫色二月兰坡地，与樱花步道形成“紫霞金浪”奇观。   - 安中大楼樱花雨：3月下旬至4月上旬，300米樱花大道飘落粉白花瓣，与求是大讲堂的红墙黛瓦构成“时空对话”。   - 南华园江南意趣：三面临水的明清古建筑群，山茶、杜鹃与竹林相映，农历三月初三的诗会更添雅韵。   2. 校园里的植物百科   - 月牙楼果园：15亩梨园承载浙大百年育种史，600余棵梨树培育出“黄花”“雪青”等品种，秋季硕果累累。   - 校友林生态课堂：银杏、枫香、三角枫等混交林形成小型植物园，每棵树均挂牌标注习性，扫码可听西迁故事。   二、建筑与地标的时空对话   1. 传统与现代的碰撞   - 求是大讲堂：仿原求是书院歇山顶建筑，铜门楼镌刻“求是创新”校训，内部举办校史展与学术活动。   - 月牙楼：建筑系与工业设计专业所在地，螺旋楼梯与玻璃幕墙构成“凝固的舞蹈”，一楼常年展出学生设计作品。   - 艺术与考古博物馆：由美国团队设计，恒温恒湿展厅陈列良渚玉器、敦煌壁画等珍品，近期特展“宋元文人画研究”不可错过。   2. 智慧校园的未来感   - 蒙民伟楼：透明玻璃穹顶下的空中花园，可俯瞰西区全景，楼内配备智能研讨室与VR实验室。   - 晓书馆：安藤忠雄设计的“光的容器”，20米挑高空间与巨型落地窗营造沉浸式阅读体验，需提前一周预约。   三、舌尖上的校园江湖   1. 亚洲最大食堂的美食矩阵   - 大食堂三楼：重庆烤鱼、东北锅包肉、广式烧腊档口林立，7个菜仅需116元，性价比碾压校外。   - 临湖餐厅：落地窗外启真湖波光粼粼，推荐杭帮菜“西湖醋鱼”与网红芒果肠粉。   - 麦思威餐吧：黑松露披萨、精酿啤酒搭配湖景，适合傍晚小酌。   2. 文创周边的趣味彩蛋   - 浙大冰品研究所：紫金港限定款“求是雪糕”，抹茶味融入玉泉校区建筑剪影，樱花味暗藏启真湖黑天鹅图案。   - 南华园茶空间：用校友捐赠的龙井茶叶制作冷泡茶，搭配荷花酥，体验“,5,,3小时,,,,2025-04-11,浙江,,正面评论,TRUE,初中,4,春,春季学期
30777915,中国汉城,文化康乐型,影视城,157384598,还可以，就是进门处的售票员逼着初中孩子出示学生证，买了学生票的孩子记得带上学生证或学生卡。,4,,,,,,2018-12-08,湖北,,正面评论,TRUE,初中,12,冬,秋季学期
83526,武汉植物园,知识科普型,植物园,202306679,来武汉植物园，有“好巳花升”！新春佳节临近，武汉植物园内春意盎然，双兰展盛装启幕，山茶茶梅红火迎春，桃花郁金香“抢鲜”绽放。 双兰展花开两朵，共绘“兰”图，分为水生温室和景观温室两个展区。水生温室兰展通过艺术装置和镜面材料，打造“水中花”、“镜中花”、“幻中花”，展示兰花的神秘与梦幻。为了迎接新年的到来，武汉植物园还精心策划了一系列活动。春节假期，非遗拓印、打卡自然印章、古风装扮秀、烟火年宵花等活动轮番上演，让游客在赏花的同时，也能体验到传统文化的魅力，还能留下独特的节日记忆。 文化润新春，欢喜过佳节。春节假期，武汉植物园还特别邀请了武汉歌舞剧院为游客送上精彩的文艺演出。演员们将以精湛的技艺和饱满的热情，为游客带来新年的颂歌和美好的祝福。   新春佳节，来武汉植物园福气多多，好礼多多。大年初一至初七，武汉植物园推出了门票赢好礼和转发送好礼活动，游客凭当日门票参与抽奖，或转发活动推文、发游玩美照至社交媒体，即有机会获得精美礼品一份。属蛇的市民，或者名字中含有“蛇”字且同音同调的市民，凭身份证可免费入园。 中国科学院武汉植物园（以下简称“武汉植物园”）筹建于1956年，1958年正式成立，是集科学研究、物种保育和科普开放为一体的综合性科研机构，是我国三大核心科学植物园之一，包含光谷、磨山、中-非联合研究中心-肯尼亚园区，江夏、新洲两个基地及多个野外观测台站。磨山园区坐落于东湖之滨、磨山南麓，面积为886亩，为国家植物资源储备和植物迁地保护的综合研究基地，现收集保育植物资源13000余种，建有世界上涵盖遗传资源最广的猕猴桃专类园、东亚最大的水生植物专类园、华中最大的野生果树专类园、华中古老孑遗和特有珍稀植物专类园、华中药用植物专类园等17个特色专类园。武汉植物园是花的世界，一年四季繁花似锦：兰花、郁金香、玫瑰花和杜鹃花、茶花、桃花、梅花、樱花、睡莲、荷花、绣球花......徜徉花海，令人心花怒放，心旷神怡，流连忘返。植物园植物繁茂，湿地多，很多鸟类在此栖息，也是拍鸟爱好者的天堂。植物园还有儿童教育科普基地，非常适合亲子、摄影、情侣出游。,5,其他出游,2小时,,,,2025-01-26,湖北,,正面评论,TRUE,初中,1,冬,寒假
10559092,张家界国家森林公园,自然观赏型,国家公园,202555074,以下是关于张家界国家森林公园的介绍：  基本概况  • 地理位置：位于湖南省张家界市武陵源区西南部，地处武陵山脉东段。  • 成立时间：1982年，中国国务院批准成立张家界国家森林公园，是中国第一个国家森林公园。  • 地貌特征：以“张家界地貌”闻名，是由石英砂岩为成景母岩，经流水侵蚀、重力崩塌、风化等作用形成的以棱角平直、高大石柱林为主的地貌景观，园内石峰林立、形态各异。  • 气候特点：属中亚热带山原型季风性湿润气候，四季分明，冬暖夏凉，年平均温度在16.4-16.8摄氏度之间，山上山下气温、日照时间不同，全年湿度较大，平均湿度可达77%。  主要景点  • 黄石寨：张家界国家森林公园的标志性景点之一，有天书宝匣、南天一柱等二十余处景点，可俯瞰整个公园美景，有“不上黄石寨，枉到张家界”的说法。 • 金鞭溪：全长约5.7公里，清澈见底，两岸山峰林立，树木葱郁，沿途有“千里相会”“水绕四门”等景点，是徒步和摄影的好去处。 • 袁家界：《阿凡达》电影的取景地之一，有著名的“乾坤柱”，还有“天下第一桥”等自然奇观，地势平坦，适合步行游览。 • 天子山：有西海石林、贺龙公园等观景台，山峰形态各异，云雾缭绕，宛如仙境，早上或傍晚时分景色最为迷人。 • 百龙天梯：世界上最高的户外电梯，垂直高度326米，运行时间约1分58秒，乘坐天梯可迅速从山脚到达山顶，能俯瞰周围的山峰和峡谷。 生物资源  • 植物：森林覆盖面积有11.33平方千米，覆盖率达90%以上，以亚热带常绿阔叶林为主，针叶和落叶阔林为辅，拥有木本植物517种，观赏植物720种，包含银杏、紫茎、白豆杉等稀有珍贵树种。  • 动物：园内动物种类丰富，有鸟类41种，兽类28种，昆虫200余种，真菌20多种，包括白冠长尾雉、云豹、金钱豹等国家一级保护野生动物，以及红脚隼、红嘴相思鸟、猕猴等国家二级保护野生动物。  旅游攻略  • 交通：可先乘飞机到张家界荷花机场，或坐火车到张家界火车站、张家界西站，再转乘班车前往景区；自驾可直接导航至景区东门。  • 门票：2025年有优惠政策，14岁以下学生、65周岁老人等免票，大学本科学历及14岁以下初中生、高中生、60-65周岁老人享受半价优惠。  • 线路规划：如第一天从东门进，乘百龙天梯上山顶，游玩袁家界、杨家界，坐环保车到天子山，乘天子山索道下山出东门；,5,情侣夫妻,,,,,2025-01-28,湖南,,正面评论,TRUE,初中,1,冬,寒假
77595,湖南博物院,知识科普型,博物馆,203435338,宋老师讲的非常精彩，讲的非常到位，我们家初二的同学听得津津入味，比学校里面的历史课精彩多了，而且宋老师还能根据观众的特点讲观众喜欢听的，感兴趣的，宋老师实在讲的太棒了，点1万个赞赞👍,5,家庭亲子,,,,,2025-02-06,湖南,,正面评论,TRUE,初中,2,冬,寒假
69101874,雷台汉文化博物馆,知识科普型,博物馆,220916760,夯土之上是道观雷台观，始建于明代，供奉雷祖及雷部诸神；下面是雷台汉墓。 雷台的两座汉墓。二号汉墓规模略小于一号。 其进愈深，墓门愈矮，须得猫腰矮身才能通过。 墓室不大，现有支撑。 跟满城汉墓相比，规模小很多，正常。 是收费景区外的展品，真品几件，仿制品也不多。马马虎虎。 p3也是不收费的展，看得出钱不少花，但水平实在有限，初中毕业的好学生也应该看不过眼，应该是为了景区评级搞的吧，比如说2p这槽多无口的展板。,4,其他出游,1小时,,,,2025-08-18,甘肃,雷台汉文化博物馆,正面评论,TRUE,初中,8,夏,暑假
79124,厦门大学(思明校区),励志拓展型,大学,157135961,这里很值得去。这里的最大亮点我认为有三个：第一个就是芙蓉湖，特别美，给人一种纯洁、宁静、秀美的感觉，来了就不想走。第二个是被列为国家重点文物保护单位的建筑群，非常值得一看；第三个亮点便是芙蓉隧道，这里趣味性很强，青年、少年、儿童应该会很喜欢。 我有一个朋友的孩子初中毕业时到厦门大学游了一次，便决定要考厦门大学，从此学习再也不用大人操心，非常自觉、用功。,5,,,,,,2018-11-03,福建,,正面评论,TRUE,初中,11,秋,秋季学期
83054,厦门科技馆,知识科普型,科技馆,177705977,适合大小朋友过来看看，很多科技原理适合初中学生看看，学习印象更深刻 小朋友的感受力会很强，大人参与一些也很开心， 里面有地震感受和潜入海底观看感受，需提前排队,5,家庭亲子,,,,,2023-07-23,福建,,正面评论,TRUE,初中,7,夏,暑假
83054,厦门科技馆,知识科普型,科技馆,174774766,带着13岁的儿子去，感觉一般。沙漠区有很多小动物，还不错，但跟科技无关。从科技馆的角度看，体现的作用不是太明显。对于初中的学生来讲没有多大帮助,3,家庭亲子,,1,-22,,2023-01-31,福建,,中性评论,TRUE,初中,1,冬,寒假
83054,厦门科技馆,知识科普型,科技馆,160766142,寓教于乐，真的很好玩，有意志游戏，有好多萌宠，孩子虽然上初中了，依然玩的很欢乐,5,,,5,0,,2019-09-04,福建,,正面评论,TRUE,初中,9,秋,秋季学期
77696,沈阳故宫,知识科普型,博物馆,165737458,2021年大年初三拜访，好像跟我六七年之前去摆设有所不同，人山人海，人挤人，想看什么都看不好，个人觉得真应避开人多时，可以好好学习观赏，今天是必须随人流移动，不然耽误别人。,4,家庭亲子,,,,,2021-02-14,辽宁,,正面评论,TRUE,初中,2,冬,寒假
77709,辽宁省博物馆,知识科普型,博物馆,180850241,丁老师是个非常好的讲解老师，我带了两个初中生，她特意用一些考点串联起孩子们更浓的学习兴趣。讲解时间也不仅仅是2个半小时，而且不知疲累始终保持微笑和热情，让我们钦佩又感动。丁老师非常博学，讲解经验丰富，期待和她有更多的互动,5,家庭亲子,,,,,2024-02-21,辽宁,,正面评论,TRUE,初中,2,冬,寒假
77709,辽宁省博物馆,知识科普型,博物馆,181238209,强烈建议不要去！他们的讲解员比较差，全是小孩子，根本不是他们推荐那些特别优秀的有经验的老讲解员，而且都是一些旅游学校的在校生，我孩子初中就认识这个讲解员，就是他们初中时候的同学没有考上重点高中的旅游学校的学生！,1,朋友出游,2小时,,,,2024-03-26,辽宁,,负面评论,TRUE,初中,3,春,春季学期
