poi_id,poi_name,poi_type,poi_subtype,commentId,content,score,touristTypeDisplay,timeDuration,sortType,commentTagId,source,publish_date,city,景点名,sentiment,is_study,age_group,月份,季节,节假日
24032365,重庆自然博物馆（新馆）,知识科普型,博物馆,177452147,新年出行，初一来到博物馆，避开了高峰，我个人感觉馆藏恐龙化石要比自贡更多更全，而且人少，可以带孩子在馆里参与多种互动，寓教于乐，真的很不错！停车也很方便，车位充足！,5,家庭亲子,,,,,2023-07-03,重庆,,正面评论,TRUE,初中,7,夏,暑假
101101,历史舞台剧《延安保育院》,知识科普型,历史文化遗产,160371218,很有教育意义，值得一看，带着读初中的儿子和爸爸看，收到了很好的感悟。,5,,,,,,2019-08-15,陕西,,正面评论,TRUE,初中,8,夏,暑假
101091,大唐西市博物馆,知识科普型,博物馆,166166176,扫二维码刷身份证免费参观，尤其要称赞这个义务讲解员小妹妹，整整一个小时的讲解，细致认真，不光讲了历史知识，还涉及了很多历史小故事，小孩子们都很喜欢听，最后询问才得知，讲解员竟然是初二的学生，真的太佩服了，历史知识丰富，还能随时回答参观人员提出的问题，现在的孩子真的太厉害了,4,,,,,,2021-04-08,陕西,,正面评论,TRUE,初中,4,春,春季学期
79407,武侯墓,知识科普型,博物馆,164904162,最大亮点：武侯祠有很多，但武侯墓仅此一处！ 景区不大，即使你是三国迷，两个小时也可以看完，建议一早开门去，比较幽静，可以在淡泊以明志宁静以致远中感受孔明先生的魅力。 缺点：景区周边是汉钢厂，工业污染严重，旅游配套做的不好。 讲解：我们请的讲解只能算及格，主要是讲解的时间较短，有点敷衍了事的感觉，游客没有标准，不知道讲解的具体流程。建议景区可以给一个讲解流程图，告诉游客哪些是必讲的，整体时间不低于多少分钟。 整体：值得去，幽静中追思诸葛丞相，让丞相的智慧和精神指导我们前行！ 惊喜：刚好碰到学校组织初中生穿汉服祭祀诸葛丞相，这样的活动不仅仅是爱国教育也是个人修为的好体验。,4,家庭亲子,,,,,2020-10-27,陕西,,正面评论,TRUE,初中,10,秋,秋季学期
75682,秦始皇帝陵博物院(兵马俑),知识科普型,博物馆,174749988,幸亏请了讲解，孙导对兵马俑以及西安的历史都非常专业，带着我们做了详细的参观和解说，孩子很激动，他初一，历史课刚好学习了这个阶段的内容，读万卷书 行万里路，就是春节期间人太多了，下次再来玩透一些，真的建议大家请正规渠道的专业导游,5,家庭亲子,,,,,2023-01-29,陕西,,正面评论,TRUE,初中,1,冬,寒假
75682,秦始皇帝陵博物院(兵马俑),知识科普型,博物馆,163869173,值得推荐，很晚才定了这个团，半小时不到就和我联系了。还好报了这个团，早上到酒店门口接，一路高速到华清宫，看网上攻略要到火车站坐915～估计🉐️两个半小时，这一上午就折腾过去了…… 幸运的跟到张虎导游～还有1328尾号的吕师傅～车技杠杠滴～华清宫的1212西安事变演出真的值得一看～孩子正好初中，历史也学习了，再加上震撼的实景体验，1个小时，198的票价还真是值^_^ 下午的兵马俑也是推荐一去的，馆内虽然人不少，但起码进门不排队～带好口罩，出示绿码即可。旅行社还给安排了兵马俑内的见解导游，很不错的一天行程,5,家庭亲子,,,,,2020-07-19,陕西,,正面评论,TRUE,初中,7,夏,暑假
75682,秦始皇帝陵博物院(兵马俑),知识科普型,博物馆,163869170,值得推荐，很晚才定了这个团，半小时不到就和我联系了。还好报了这个团，早上到酒店门口接，一路高速到华清宫，看网上攻略要到火车站坐915～估计🉐️两个半小时，这一上午就折腾过去了…… 幸运的跟到张虎导游～还有1328尾号的吕师傅～车技杠杠滴～华清宫的1212西安事变演出真的值得一看～孩子正好初中，历史也学习了，再加上震撼的实景体验，1个小时，198的票价还真是值^_^ 下午的兵马俑也是推荐一去的，馆内虽然人不少，但起码进门不排队～带好口罩，出示绿码即可。旅行社还给安排了兵马俑内的见解导游，很不错的一天行程,5,家庭亲子,,,,,2020-07-19,陕西,,正面评论,TRUE,初中,7,夏,暑假
75682,秦始皇帝陵博物院(兵马俑),知识科普型,博物馆,167199191,这是我见过最差的导游，全程大部分时间都用来推销看演出，买东西，专业知识非常差劲，什么都没讲出来，讲些没用的，问她秦始皇陵一些基本知识都答不出来，守着资源都不学习专业性太差，讲些初中课本内容，太差劲了，除了推销，兵马俑之类的看看就走，说的内容也不严谨，胡说八道，感觉就是被坑了,1,情侣夫妻,,1,-12,,2021-07-18,陕西,,负面评论,TRUE,初中,7,夏,暑假
75679,西安半坡博物馆,知识科普型,博物馆,161704165,因为孩子刚上初中学习了有关知识，所以带孩子和她的同学一起去看看，孩子们特别高兴，客服中心的服务人员很热情，推荐电子讲解很方便。,5,,,,,,2019-10-25,陕西,,正面评论,TRUE,初中,10,秋,秋季学期
75679,西安半坡博物馆,知识科普型,博物馆,181602922,领即将上初中的儿子和同学一起去的，希望可以对学历史有帮助。馆内碰到几队研学的小朋友，估计家长的想法都是相同的😁😁坐地铁1号线直接到半坡站，步行10分钟左右即到。,5,家庭亲子,,,,,2024-04-28,陕西,,正面评论,TRUE,初中,4,春,春季学期
75679,西安半坡博物馆,知识科普型,博物馆,162245614,带孩子去研学，对初一孩子来说，刚开始不怎么感兴趣，慢慢的开始主动问，到后来开始和我讨论，实体教学效果不错，整体效果很好！,5,,,,,,2019-12-09,陕西,,正面评论,TRUE,初中,12,冬,秋季学期
75679,西安半坡博物馆,知识科普型,博物馆,186554838,没约上陕历博，退而求其次来了这里，里面比较大，人不多，环境不错，初中历史会学习半坡遗址，对孩子的学习有一定的促进作用。,5,家庭亲子,,,,,2024-07-18,陕西,,正面评论,TRUE,初中,7,夏,暑假
75679,西安半坡博物馆,知识科普型,博物馆,157946165,带孩子去看的，孩子初中生，正好学习这一段历史，把书本上的东西搞活了，很好的一次体验。,5,,,,,,2019-02-18,陕西,,正面评论,TRUE,初中,2,冬,寒假
10532757,西安博物院,知识科普型,博物馆,186658123,没约上陕历博，约了这边，虽然天很热，人很多很挤，但是李潇潇讲解员讲得非常专业，家里老人和初中学生都觉得很有收获，必须好评,5,家庭亲子,,,,,2024-07-19,陕西,,正面评论,TRUE,初中,7,夏,暑假
101097,西安碑林博物馆,知识科普型,博物馆,175734958,优点：1.碑林名家字体多值得看。2.自己不专业又带孩子还是得请讲解解读更能看出门道。3.讲解相对比较负责，一直在讲解。缺点：1.一开始讲解器反复串频道耽误了很多时间。建议：1.深度讲解3小时感觉挺累的，小孩一次吸收不了这么多，建议携程开发出适合小学初中生的碑林趣味寻宝研学的散团。2.建议携程对讲解员实名制可选择，能看到讲解员的评分高低来选择。,4,家庭亲子,,,,,2023-05-04,陕西,,正面评论,TRUE,初中,5,春,五一假期
101097,西安碑林博物馆,知识科普型,博物馆,164827859,值得推荐，历史浑厚的一个地方 硕大的碑上各种字体篆刻 园内的导游讲解非常细致 上课一次历史课 体验很好，园内比较安静 每一个房间都挤满人 大部分学生为主 非常适合初中生去学习 ,5,家庭亲子,,,,,2020-10-19,陕西,,正面评论,TRUE,初中,10,秋,秋季学期
133987592,陕西考古博物馆,知识科普型,博物馆,189894573,陕西考古博物馆真的很棒！它是新馆，面积大、展示丰、设施好，人很多也不会热（人也没有很多），三层楼逛得很尽兴。可以免费预约来，但还是强烈建议买讲解，2.5h/3h都行，我们约的就是3h，王姗老师的讲解很细致生动，一路顺着历史脉络听下来涨了不少考古和历史方面的知识，也没有错过重点展品（有一个镇馆之宝如果没有讲解老师提醒的话很容易错过！错过错亿啊），体验完就真的很庆幸当初订了专业老师的讲解，不然体验真的会差很多、错过知识洗脑的感觉，历史爱好者一本满足！讲解结束后可以自己再走回头路看看之前略过的展区，展区里互动设置还不少（注意：因为陕西考古博物馆跟考古研究所各种意义上的很近，是真的可以在互动设置摸到真·文物的），对历史很感兴趣看得很细的话真可以泡一天。 也很推荐有孩子的家庭带孩子来学习感受，不过因为主要是更侧重考古、遗址方面，专业性比起其他文物为主的博物馆专业性更强了，不建议带太小的孩子来（会听不懂进而无聊），也不建议带对历史完全不感兴趣甚至厌恶的孩子来（听起步两个半小时的大课会很无聊），带初高中年龄是感觉最适合的。全成年人来也很合适！大孩子也是孩子（👉🏻👈🏻🥹）,5,家庭亲子,4小时,,,,2024-08-17,陕西,,正面评论,TRUE,初中，高中,8,夏,暑假
13826401,陕西自然博物馆,知识科普型,博物馆,178277895,地质科普，从小学生道初高中生都能学到知识，还有几百种甲虫🐞标本，我的天。暑期的西安太热了，推荐带孩子来这里，既学习又避暑。,5,家庭亲子,,,,,2023-08-13,陕西,,正面评论,TRUE,小学，初中，高中,8,夏,暑假
13826401,陕西自然博物馆,知识科普型,博物馆,178277869,地质科普，从小学生道初高中生都能学到知识，还有几百种甲虫🐞标本，我的天。暑期的西安太热了，推荐带孩子来这里，既学习又避暑。,5,家庭亲子,,,,,2023-08-13,陕西,,正面评论,TRUE,小学，初中，高中,8,夏,暑假
13826401,陕西自然博物馆,知识科普型,博物馆,178277880,地质科普，从小学生道初高中生都能学到知识，还有几百种甲虫🐞标本，我的天。暑期的西安太热了，推荐带孩子来这里，既学习又避暑。,5,家庭亲子,,,,,2023-08-13,陕西,,正面评论,TRUE,小学，初中，高中,8,夏,暑假
97808,青藏高原自然博物馆,知识科普型,博物馆,159940385,本来是去藏文化博物馆的，就在对面就是自然博物馆，初中的孩子去很喜欢也看到不少西宁的中学生在看展，这里对于地理，历史，生物的知识都很丰富,5,,,,,,2019-07-26,青海,,正面评论,TRUE,初中,7,夏,暑假
76033,香港太空馆,知识科普型,科技馆,200307963,香港太空馆是香港一个专注于天文和太空科学的教育及娱乐场所，位于尖沙咀的海滨公园内。   主要设施**    - **天文馆**：拥有一个先进的天文投影系统，提供各种天文影片和演示，观众可以沉浸在星空的奇妙之中。    - **展览厅**：展示与天文学、太空探索和宇宙相关的各类展品，包括模型、互动装置和资讯图板。  互动体验**    - **仿真太空任务**：游客可以参加交互体验，仿真太空任务，了解宇航员的工作和太空任务的挑战。    - **观星活动**：定期举办观星活动，让游客有机会使用望远镜观察天体。  教育活动**    - **科学讲座**：定期举办各类科学讲座和工作坊。  特别展览**    - 不定期会举办特别展览，介绍最新的太空科技  营业时间： 星期一、三至五：下午1时至晚上9时 星期六、日及公众假期：上午10时至晚上9时 圣诞前夕及农历新年除夕提前于下午5时休馆 星期二（公众假期除外）、农历年初一及二休馆 提示：展览厅逢星期三免费入场  地址：香港九龙尖沙咀梳士巴利道10号,5,,,,,,2024-12-24,香港,,正面评论,TRUE,初中,12,冬,秋季学期
38418331,富锦市博物馆,知识科普型,博物馆,163675849,就初一学校带领去过一次 还不错,5,,,,,,2020-06-18,黑龙江,,正面评论,TRUE,初中,6,夏,春季学期
