poi_id,poi_name,poi_type,poi_subtype,commentId,content,score,touristTypeDisplay,timeDuration,sortType,commentTagId,source,publish_date,city,景点名,sentiment,is_study,age_group,月份,季节,节假日
13826401,陕西自然博物馆,知识科普型,博物馆,178277895,地质科普，从小学生道初高中生都能学到知识，还有几百种甲虫🐞标本，我的天。暑期的西安太热了，推荐带孩子来这里，既学习又避暑。,5,家庭亲子,,,,,2023-08-13,陕西,,正面评论,TRUE,小学，初中，高中,8,夏,暑假
13826401,陕西自然博物馆,知识科普型,博物馆,178277869,地质科普，从小学生道初高中生都能学到知识，还有几百种甲虫🐞标本，我的天。暑期的西安太热了，推荐带孩子来这里，既学习又避暑。,5,家庭亲子,,,,,2023-08-13,陕西,,正面评论,TRUE,小学，初中，高中,8,夏,暑假
13826401,陕西自然博物馆,知识科普型,博物馆,178277880,地质科普，从小学生道初高中生都能学到知识，还有几百种甲虫🐞标本，我的天。暑期的西安太热了，推荐带孩子来这里，既学习又避暑。,5,家庭亲子,,,,,2023-08-13,陕西,,正面评论,TRUE,小学，初中，高中,8,夏,暑假
10795375,西宁野生动物园,知识科普型,动物园,175951795,高中学习生物，青海野生动物野马野驴野骆驼,5,,,,,,2023-05-26,青海,,正面评论,TRUE,高中,5,春,春季学期
10534852,香港铁路博物馆,知识科普型,博物馆,162178111,要到这里并不容易。首先，我需要坐火车到大埔站，然后步行到这个博物馆（你也可以在太和站下车，然后步行到这个博物馆）。但我是铁路粉丝，所以我下定决心走远路。从外面看，火车站看起来像一座庙宇。事实上，它是旧九龙铁路线上唯一具有这种特征的车站。在博物馆内，我意识到它与高雄塔高铁路博物馆相似 - 旧售票处，旧铁路车票，铁路模型，铁路线路和车站老照片，等。就像塔高一样，这个博物馆有旧轨道，旧机车。但不同的是，塔高铁路博物馆已将火车场区改造成哈马森铁路文化公园。还有一个哈马森铁路博物馆 - 非常棒的！停用的旧大埔墟火车站是一充满中国特色青瓦建筑，现已改为火车博物馆。展馆地方较小，可参观的项目也不多，但若果喜欢古董火车，或作为小朋友教育媒体，或休憩的地方，则不失为一不错的选择⋯⋯ 居港这么多年，一直没有太多动力专程来参观。,4,,,,,,2019-12-02,香港,,正面评论,TRUE,高中,12,冬,秋季学期
24652141,齐齐哈尔博物馆,知识科普型,博物馆,178106206,齐齐哈尔也就博物馆还算可以。希望高科技的含量在提高一些就更完美了！推荐学生经常去，多了解历史，体会到美好生活的来之不易，珍惜现在，努力奋斗。,5,家庭亲子,,,,,2023-08-02,黑龙江,,正面评论,TRUE,高中,8,夏,暑假
